ID,Name,Type,Keywords,Range,Description,Requirements,Combined Costs,Mana Cost,AP Cost,RP Cost,Other Costs,Benefits,Associated Abilities,Parent Ability,Subdivision Index,Gathering Cost,Gathering Bonus
secret_art__galaxy_stop,Secret Art: Galaxy Stop,true_ability,Secret Art,2000ft Radius,"You create a space-time anomaly that freezes time itself in a local area for a short while, affecting all but the strong-willed.  All non-heroic units in range cannot take any actions until the end of their next turn.",,AP: 3 MP: 3,3,3,,,,,,,,
secret_art__gate_of_fate,Secret Art: Gate of Fate,true_ability,"Divination, Secret Art, Aid",120ft,"You subvert fate and a bad end, twisting reality into its most fortunate outcome.  When a target ally rolls a 1, you can instead change it to a 20.",An ally rolls a 1.,MP: 1 RP: 0,1,,0,,,,,,,
secret_art__guiding_shot,Secret Art: Guiding Shot,true_ability,"Secret Art, Sure Hit",Ranged Weapon Range,"You may make a Heavy attack against the target. The target may spend 1 RP to avoid the attack. If they do, you may Sidestep them up to 20ft in a direction of your choice and then trigger a Place Trap effect, provided you have at least one set up.

This trap effect does not count towards your per encounter limitation. You may not Sidestep an enemy into a hazard (such as off a cliff or into fire) apart from your trap, unless the target has nowhere else to go.",,AP: 2 MP: 2,2,2,,,,,,,,
secret_art__jade_skin,Secret Art: Jade Skin,true_ability,"Secret Art, Disarm",Self,"You take the Block action against the triggering attack. If you reduce the damage to 0, the attacker becomes Disarmed until the start of their next turn.",You are attacked by a Melee attack.,MP: 2 RP: 0,2,,0,,,,,,,
secret_art__life_bet,Secret Art: Life Bet,true_ability,Secret Art,Melee Weapon Range,You reduce your HP to 1 and make a Heavy attack against the target. You gain a bonus to the damage roll of this attack equal to the amount of HP you lost through this ability.,,AP: 2,,2,,,,,,,,
secret_art__life_sacrifice,Secret Art: Life Sacrifice,true_ability,"Healing, Secret Art, Aid",40ft,You lose HP until your HP reaches 1. Another ally within range recovers that much HP. Any HP that exceeds the target’s max HP becomes temporary HP.,,AP: 1,,1,,,,,,,,
secret_art__lifesaver,Secret Art: Lifesaver,true_ability,"Secret Art, Shield, Spell",40ft,The target gains temporary HP until the end of the encounter equal to their missing HP.,,AP: 4 MP: 5,5,4,,,,,,,,
secret_art__lightning_field,Secret Art: Lightning Field,true_ability,"Lightning, Secret Art, Spell, Upkeep",30ft,"You conjure a statically charged field around you, applying Static X where X equals your Power x 3 to all enemies within 30ft of you. Enemies already afflicted by Static immediately take damage equal to 3 + half the static value. While within your Lightning Field, the Static on enemies is not removed at the end of their turn.

This field lasts until the end of your next turn.

Upkeep:You may pay 1 Mana at the start of your turn to repeat the initial effect and extend the duration of the field by 1 turn.",,AP: 2 MP: 3,3,2,,,,,,,,
secret_art__meteor,Secret Art: Meteor,true_ability,"Fire, Overcharge, Spell, Sure Hit, Secret Art",120ft,"You mark a 30x30ft area and begin summoning a meteor to strike it at the start of your next turn. Those in the area when it lands take Heavy Fire Damage. You cannot use the Prepare action on this ability. Overcharge: You may spend extra AP on this ability to increase the damage and size of it. For every extra 2 AP spent on it, the size increases by 5ft and the damage increases by your Power. If the Overcharge increases the AP cost to above 4, this ability gains the Setup keyword. You mark the area of this ability when you have finished spending all AP on it and not before. The maximum AP you can spend on this ability is 16 AP.",,AP: 2 MP: 4,4,2,,,,,,,,
secret_art__moving_castle,Secret Art: Moving Castle,true_ability,"Secret Art, Aura, Upkeep",Self,"You project a defensive aura up to 15ft around you, granting all allies (excluding yourself) theBulwarkbuff. While under the effects of Bulwark, allies take 3 less damage.

While projecting this aura, you may spend 0 RP to sidestep up to your movement. After you do so, you may not do so again until the start of your next turn.

Upkeep: You must spend 1 mana at the start of your turn to continue this effect.",,AP: 2 MP: 2,2,2,,,,,,,,
secret_art__mushroomize,Secret Art: Mushroomize,true_ability,"Healing, Spell, Upkeep, Concentration",Sight,"You fill your target with mycelium from your spore symbiote, allowing them to act fully despite being Downed. Removing Spore Symbiote from the target cancels this effect. This effect ends at the start of your next turn unless you spend 1 mana to continue the effect.  When paying upkeep, if the target is below 0 HP, heal the target for your power + 3.This effect ends if the target’s HP is reduced to negative their maximum HP amount.You can use 1 RP instead of 2 AP to use this ability.",Must be used on your Spore Symbiote target that is in the Downed state.,AP: 2,,2,,,,,,,,
secret_art__mythical_awakening,Secret Art: Mythical Awakening,true_ability,Secret Art,Self,"You channel your power into your mount, allowing it to unleash a devastating attack based on what type of mount it is.

Pegasus: Bellerophon: You Sidestep towards a target within 60ft and make a Heavy attack against it. This attack has Lock-on and costs 1 RP and 2 Mana

Wyvern: Reginliev: You make a Heavy attack against all enemies in a 5ft wide line up to a point within 60ft. You also make a Heavy attack against all enemies within 10ft of the selected point, though enemies can also take an attack from this ability once. This attack costs 2 AP and 2 Mana.

Dragonfly: Darting Mirage: You move at incredible speed and create several illusionary afterimages in your wake. Until the start of your next turn, every attack against you or your mount that is not a critical hit or does not have the Sure Hit keyword  automatically misses. This is an Illusion effect. This ability costs 0 AP and 4 Mana.

All these attacks are made with your mount’s stats instead of your own.",Must be mounted on a mount mentioned in the description.,,,,,,,,,,,
secret_art__nightcaller,Secret Art: Nightcaller,true_ability,Secret Art,Self,"Until the end of the encounter, it is considered night for all your abilities and items that are affected by it.",,AP: 0 MP: 4,4,0,,,,,,,,
secret_art__overcharge,Secret Art: Overcharge,true_ability,Secret Art,Self,Reduces the mana cost of your next Spell cast this turn by 3. You cannot gain mana from this.,,AP: 0,,0,,,,,,,,
secret_art__override,Secret Art: Override,true_ability,"Secret Art, Sure Hit, Pass",Self,"You make a Heavy attack against all enemies in a line and move through them. You keep moving through enemies until you reach an empty spot you can stand in. If there is no valid end position due to an ally occupying the spot or terrain (such as a wall) being in the way, you cannot use this ability.",Must be mounted.,AP: 3 MP: 3,3,3,,,,,,,,
secret_art__perfect_repetition,Secret Art: Perfect Repetition,true_ability,Secret Art,Ranged Weapon Range,"You may make a Heavy Attack against the target. On damage, on the next turn, you may repeat this attack against the same target using the same accuracy check as the initial attack. You may continue to repeat this attack on subsequent turns until you spend a turn not using this move or if the attack fails to deal damage.",,AP: 2,,2,,,,,,,,
secret_art__pyroblast,Secret Art: Pyroblast,true_ability,"Fire, Secret Art, Spell",60ft,You may make a Heavy Attack against the target that deals double Heavy Fire Damage. This attack gains Lock On against a target that has the Burning condition that you inflicted on it.,,AP: 4,,4,,,,,,,,
secret_art__razor_hurricane,Secret Art: Razor Hurricane,true_ability,"Concentration, Full Pierce, Secret Art, Spell, Wind",30ft,"You create a rapid spinning hurricane with a 15x15 size and 50ft in height in the target location. All creatures caught in the hurricane immediately take Physical(Slashing) Light Damage and are pushed out of the Hurricane. Every creature that enters the hurricane immediately takes Physical(Slashing) Light Damage and must succeed at a save against your Potency or be pushed back 20ft. Leaving the hurricane does no damage and requires no save.Upkeep:You must spend 1 Mana and 2 AP at the start of each turn or the spell ends. When you pay this Upkeep, you may move the hurricane up to 20ft. Any creature that comes into contact with the hurricane during this move takes damage and must make a save as if they had entered it.",,AP: 4 MP: 3,3,4,,,,,,,,
secret_art__revitalize,Secret Art:  Revitalize,true_ability,"Healing, Overcharge, Secret Art, Spell",60ft,"You pray for a Downed ally. The ally’s HP becomes 0 and then heals for your Power x 3.

Overcharge:You may pay X extra mana to make the target heal + 7 HP for every additional point of mana spent.

This ability does not work on Mortally Wounded allies.",Ally is downed.,AP: 2 MP: 2,2,2,,,,,,,,
secret_art__rewind,Secret Art: Rewind,true_ability,Secret Art,Self,"You rewind time to before your last action. All results based on your last action are reversed- All HP, Mana, AP and RP are returned to how they were. The ability you used in that action is no longer considered used, but this ability is.",Can only be used on your turn.,MP: 1 RP: 0,1,,0,,,,,,,
secret_art__ride_of_the_valkyrie,Secret Art: Ride of the Valkyrie,true_ability,"Secret Art, Sidestep, Healing, Pass",Self,"You Sidestep up to your speed and can move through enemies for this movement. You and every ally you pass through are healed for 11 + (Power x 2).

This movement must always be in a straight line, regardless of your mount type.",Must be mounted.,AP: 4 MP: 3,3,4,,,,,,,,
secret_art__seventeen_dissection,Secret Art: Seventeen Dissection,true_ability,"Full Pierce, Secret Art, Sure Hit",Melee Weapon Range,"You deal 17 true damage to the target. If this damage lowers the target’s HP to 0 or lower, they immediately die.If the target of this attack is a non-heroic unit, they instantly die regardless of their remaining HP.",Slashing weapons only.,AP: 3,,3,,,,,,,,
secret_art__shatter,Secret Art: Shatter,true_ability,"Secret Art, Sure Hit",Melee Weapon Range,"You make a Heavy Attack against the target using a Blacksmith’s Hammer. If the target chooses to Block the attack, they gain 100 damage reduction against it. If they do, choose one equipped non-divine arms weapon in their hand that has equal or less crafted enhancements than your hammer and destroy that item, giving it the Broken condition.",Attack must be made with a Blacksmith's Hammer.,AP: 2 MP: 2,2,2,,,,,,,,
secret_art__shield_wall,Secret Art: Shield Wall,true_ability,Secret Art,20ft,The damage you and your allies in range affected by the same ability take is reduced by 75.,"Usable when you are the target of an ability that affects an area, using a shield.",MP: 6 RP: 1,6,,1,,,,,,,
secret_art__shock_awe,Secret Art: Shock & Awe,true_ability,Secret Art,40ft,"You and up to 3 other allies within range gain 3 AP they must spend immediately. On their next turn, they regain 1 less AP.

These AP may not be spent on Setup abilities and normal once per turn ability limitations apply.",,AP: 4 MP: 1,1,4,,,,,,,,
secret_art__spectrum_blade,Secret Art: Spectrum Blade,true_ability,"Enchantment, Secret Art",Self,"Until the end of the encounter, you enchant your weapon with every single element. When using Elemental Strike or Elemental Sweep, you may choose which effect you want regardless of the damage type your attack deals. When you deal damage, you apply the damage type that would deal the most damage.

In addition, your weapon gains a +1 Power bonus until the end of the encounter. If it already had a +1 Power bonus through an enchantment, this bonus is instead increased to +2.

If you are not holding the enchanted weapon at the start of your turn, your weapon loses this benefit.",,AP: 1 MP: 2,2,1,,,,,,,,
secret_art__spirit_stigma,Secret Art: Spirit Stigma,true_ability,"Secret Art, Spell, Dark",60ft,"You stigmatize the targets spirit, they are inflicted with Spirit Stigma until the start of your next turn. A target with Spirit Stigma counts as a willing ally for your Eremancer abilities and damaging them fulfills the Malevolent  Phantasm requirement.",,AP: 0,,0,,,,,,,,
secret_art__summon_eidolon,Secret Art: Summon Eidolon,true_ability,"Summon, Spell, Upkeep, Secret Art",30ft,"Your contracted Eidolon hears your call and sends a proxy of themselves to fight for you.  The Eidolon called and the costs are dependent on your attunement.  Lasts up to 5 minutes.  You must pay the upkeep cost under the Eidolon’sSummonSkill or the Eidolon vanishes.

Unless the summon has a skill that says otherwise, a summon acts after you on initiative, but cannot act the round it is summoned, except for RP actions.",,,,,,,,,,,,
secret_art__the_grand_theater,Secret Art: The Grand Theater,true_ability,Secret Art,40ft,"All allies within range may sidestep up to their movement speed.

You may Sidestep all enemies within range up to their movement speed.

After all targets have moved, everyone that was originally in range of this ability immediately gains 2 AP they must spend on attacks against other creatures if possible.",,AP: 4 MP: 3,3,4,,,,,,,,
secret_art__titan_blade,Secret Art: Titan Blade,true_ability,"Sure Hit, Full Pierce, Secret Art",40ft,"You greatly increase the size and weight of your weapons, then slam them down in a direction. You make a melee Heavy attack against all enemies in a 15ft wide line up to the range. On damage, a target is knocked prone.

After the initial hit, a shockwave follows. You make another Heavy attack against any enemy still in the original line’s range. This second attack has the Sure Hit and Full Pierce qualities against a prone target.",Two-Handed melee weapons only.,AP: 2 MP: 4,4,2,,,,,,,,
secret_art__transmute_proto_armatae,Secret Art: Transmute Proto Armatae,true_ability,Secret Art,Self,"You touch the ground, transmuting a Proto Armatae of your own design.  The Proto Armatae lifts you up and immediately encases you into its cockpit.   The Proto Armatae is 15ft tall and is a large creature that occupies a 15ftx15ft space.  All creatures and moveable objects surrounding the Proto Armatae are pushed back away from its zone of control in a burst of steam.  The Armatae also gains a temporary shield with 20 HP that disappears at the start of your next turn.

You must use your own actions to cause the Proto Armatae to move and attack.  You can eject from a transmutation hatch on the top at the center of the Proto Armatae for 1 AP, in which the Proto Armatae stops functioning.  When you re-enter you must close the hatch for 1 AP before the Proto Armatae functions again.

The Proto Armatae has health equal to 15 + 5x Focus and it uses your AP and RP for actions.  You can channel your Transmuter abilities through the Proto Armatae, and Transmute Weapon can create a giant sized weapon for the Armatae to use.

You may also spend 1 RP to use this ability instead of the AP cost.

Only usable once.  You regain the use of this ability when you gain an Interlude Point.

Proto Armatae

HP: –

Evasion: 9/19

Guard: 4/14

Mini Transmutation Cannon (Right Arm)

Cost: 0 AP

Range: 40ft

Description:  Fires a mini transmutation cannon of deconstructive energy making a light attack against a target.  Doesn’t provoke attacks of opportunity.

Humanoid Gripper (Left Arm)

Description: Humanoid Gripper can make all basic attacks.  It is proficient in any transmuted weapon it holds.  Its regular melee attacks deal light weapon damage and any transmuted weapon it wields gains the benefit of that weapon category.",,AP: 2 MP: 4,4,2,,,,,,,,
secret_art__true_serenity,Secret Art: True Serenity,true_ability,"Secret Art, Stance",Self,You enter the Serene Water stance and gain an additional +17 bonus to your Evasion until the start of your next turn.,,MP: 2 RP: 1,2,,1,,,,,,,
secret_art__tsubame_gaeshi,Secret Art: Tsubame Gaeshi,true_ability,"Lock On, Secret Art, Sure Hit",Melee Weapon Range,"You may make a Heavy Attack against the target 3 times. On the first miss, the next attacks gain Lock On. On the second miss, the next attack gains Sure Hit. These only apply to attacks made during Tsubame Gaeshi.",Katana only.,AP: 4 MP: 3,3,4,,,,,,,,
secret_art__ultimate_spell,Secret Art: Ultimate Spell,true_ability,,Self,The next Spell you cast this turn with an AP cost lower than 5 deals true damage.,,AP: 0 MP: 4,4,0,,,,,,,,
secret_art__unholy_strength,Secret Art: Unholy Strength,true_ability,"Secret Art, Upkeep",Self,"You GainUnholy Strengthwhich grants +2 Power and Focus. While Unholy Strength is active your attacks/abilities that use your melee weapon to deal physical damage inflict Dark Damage instead and yourBone Armorwill not break from damage.

Upkeep:1 Mana.",,AP: 2 MP: 3,3,2,,,,,,,,
secret_art__walking_church,Secret Art: Walking Church,true_ability,Secret Art,120ft,"Blesses the target, granting them the status of a church. Until the end of your next turn, the target gains Damage Reduction 1000 against all damage types.",,MP: 1 RP: 1,1,,1,,,,,,,
secret_art__whirling_death,Secret Art: Whirling Death,true_ability,"Secret Art, Stance",Self,"You enter the Whirling Death stance, spinning wildly and shooting at enemies within range. While in this Stance you may spend 2 AP to make a Light Attack against all enemies within 20ft.

These Light Attacks haveKilling Blow: Repeat this attack.The Stance lasts until you enter a different Stance or until you make an attack that is not tied to this ability.",,AP: 0 MP: 3,3,0,,,,,,,,
secret_art__whiteout,Secret Art: Whiteout,true_ability,"Encounter Start, Frost, Spell, Upkeep, Concentration",2500ft radius on self,"You create a sudden snowstorm that obscures sight, creating difficult battle conditions. Attack accuracy for all affected units is reduced by your Focus. Units with ""Ice Cold"" or Frost Immunity are not affected by this ability. The snowstorm ends at the end of your next turn, unless you pay 3 mana to Upkeep.

You may activate this ability as an Encounter Start action during the Encounter Start phase of an encounter. If you do, you do not pay the RP cost.",,RP: 2,,,2,,,,,,,
secret_talisman,Secret Talisman,true_ability,Special,Special,You use a talisman you possess that contains a Secret Art. This functions like using a normal talisman. You may only use this once per encounter. Does not count towards your Secret Art usage for this encounter.,Special,Other: Special,,,,other: Special,,,,,,
seismic_shove,Seismic Shove,true_ability,"Spell, Earth",80ft,"You make a Light attack that deals Earth damage against the target. On damage, you may push the target 5ft in any direction.",,AP: 1 MP: 1,1,1,,,,,,,,
selective_casting,Selective Casting,true_ability,,Self,"For the next Spell you cast, you may choose to have it not affect a number of targets equal to your Focus.",,MP: 1 RP: 0,1,,0,,,,,,,
send_to_armory,Send To Armory,true_ability,Spell,Touch,"You touch an item not held or carried by another creature and immediately teleport it to your Dimensional Armory into an unoccupied space (if there is room).  If there is no space the spell fails.  Some magic items can be rejected by the dimensional armory.  Living creatures cannot be teleported into the Dimensional Armory.

Overcharge:You spend 1 minute instead of 2 AP, reducing the mana cost by 1.",You have a Dimensional Armory active.,AP: 2 MP: 1,1,2,,,,,,,,
sense_magic,Sense Magic,true_ability,"Sensory, Spell",60ft radius centered on self,"You can detect active magical effects that aren’t hidden within range.

Hidden magical effects may require a Perception or Insight check.",None,AP: 1,,1,,,,,,,,
separate_wheat_from_chaff,Separate wheat from chaff,true_ability,"Killing Blow, Fear, Mind Affecting",10ft,"You make a Light attack against all enemies in range. On damage, you push the target back 5ft. If you landed a Killing Blow, all that took damage become Shaken as well.",Scythe only,AP: 3 MP: 1,1,3,,,,,,,,
serene_water_stance,Serene Water Stance,true_ability,Stance,Self,"You enter the Serene Water Stance. While in this Stance, you gain a +3 bonus to your evasion and you may move 5ft everytime an accuracy check against you misses. This movement does not provoke attacks of opportunity. This Stance lasts until you enter a different Stance, you use the Block action or until you move, with the exceptions of this ability and movement abilities with the Unarmed Strike keyword. Making an attack does not cancel this Stance.",An attack against you misses.,MP: 1 RP: 0,1,,0,,,,,,,
shade_form,Shade Form,true_ability,Shadow,Self,"You become like a shade becoming near weightless and gaining the ability to pass through spaces occupied by other creatures. You can also slip through small cracks in walls or doors, as long as they are at least 1inch wide and tall.Upkeep:You must pay 2 mana at the start of each turn or this ability ends. During the night, the mana cost and Upkeep of this is reduced by 2.",,AP: 1 MP: 2,2,1,,,,,,,,
shadow_cloak,Shadow Cloak,true_ability,Shadow,Self,"You cloak yourself in Shadows, giving you a +5 bonus on Stealth checks until end of scene. It also allows you to hide even when not behind cover or concealment, but with a -15 penalty. During the night, the mana cost of this is reduced by 2.",,AP: 2 MP: 2,2,2,,,,,,,,
shadow_step,Shadow Step,true_ability,"Shadow, Teleport",Self,"You may Teleport up to twice your movement speed. During the night, the mana cost of this is reduced by 2.",,AP: 1 MP: 2,2,1,,,,,,,,
share_armor,Share Armor,true_ability,Aid,30ft,"Your ally may treat their guard and block as if they were wearing your armor until the end of the current creature’s turn. If multiple creatures of the same type move on the same initiative, it lasts through all of their turns.

Any temporary increases to the guard/block of this armor (such as through reinforce armor) is not transferred over.",Must be wearing armor.,RP: 1,,,1,,,,,,,
shared_darkness,Shared Darkness,key_ability,,,,,AP: 1,,1,,,"The range of your darkvision increases by 60ft., You may use Darkvision.",Darkvision (darkvision),,,,
shared_defense,Shared Defense,true_ability,,120ft,"Your mount (the last mount you were riding on this arc) may use your defenses instead of its own while within range. In addition, you may spend RP for it while dismounted if your mount is in range.",Must be dismounted.,,,,,,,,,,,
shatter,Shatter,true_ability,Sound,30ft,Every enemy within range must make a save against your Potency or take Light Damage. Any unattended objects made of glass or a similar vulnerable material also shatter.,,AP: 3 MP: 1,1,3,,,,,,,,
shatter_time,Shatter Time,true_ability,Encounter Start,Self,"For this encounter you may act during different parts of a round. When you end your turn with AP remaining, you may choose to act immediately after another creature ends their turn. You do not regain AP or RP and these extra actions are not considered turns. You may take these extra actions multiple times during a round, provided you have AP remaining.

You cannot use Setup abilities during this extra actions.",,,,,,,,,,,,
sheet_ice,Sheet Ice,true_ability,"Frost, Spell, Upkeep",120ft,"You freeze the ground in a 20x20 area, creating difficult terrain that lasts until the end of your next turn.  You may use 1 mana per instance of this spell to continue the effect until the end of your next turn.",,AP: 1,,1,,,,,,,,
shelter,Shelter,true_ability,,5ft,The attack targeting your VIP instead targets you. You may use this even if you’re also a target of the attack and both attacks will resolve against you. You also gain the benefits of the Block action against the triggering attack.,Your VIP is the target of an attack.,RP: 1,,,1,,,,,,,
shield_burst,Shield Burst,true_ability,Spell,40ft,"You heal the target for an amount equal to half the temporary HP they have, then all temporary HP on them is removed. All enemies within 5ft of the target must make a save against your Potency or be pushed back 10ft.

You may use 1 AP instead of 1 RP for this ability.",Target must have temporary HP applied by you.,RP: 1,,,1,,,,,,,
shieldcrusher,Shieldcrusher,true_ability,Broken,Melee Weapon Range,"You make a Heavy attack against the target. If they Block against this attack and are wielding a shield or greatshield, that shield becomes Broken.",Two-handed weapons only.,AP: 2 MP: 1,1,2,,,,,,,,
shielding_fist,Shielding Fist,key_ability,,,,,,,,,,"While you have at least 1 hand empty and aren't wielding a shield, you gain a +4 bonus to your block.",,,,,
shooting_form,Shooting Form,true_ability,Rapid,,"You transform a melee weapon you’re holding into a Wand Channeling Weapon or return a transformed weapon back to normal. While transformed, the weapon keeps any relevant enchants and functions exactly like how a wand would. You are considered proficient in this wand, even if you normally wouldn’t be and can fire Arcane Elemental shots with it, even if you normally wouldn’t be able to.",,RP: 0,,,0,,,,,,,
shrug_it_off,Shrug it off,key_ability,,,,,MP: X RP: 0,X,,0,,You may use Vital Drive II.,Vital Drive II (vital_drive_ii),,,,
silentium,Silentium,true_ability,"Combo, Holy",Weapon Range,"You infuse a light thrown weapon with Sacred Power and Light Attack the target for Light Holy Damage. On damage the weapon disrupts the target’s magic circuits, breaking concentration and preventing the target from using abilities with the Spell keyword. The lodged weapon can be removed for 1 RP or 2 AP, removing the disruption.Combo:If used after Eagle’s Hunt, reduce the AP cost to 0 from 2.",One-handed Thrown Weapon or Sets of missiles Only.,AP: 2 MP: 1,1,2,,,,,,,,
