ID,Name,Type,Keywords,Range,Description,Requirements,Combined Costs,Mana Cost,AP Cost,RP Cost,Other Costs,Benefits,Associated Abilities,Parent Ability,Subdivision Index,Gathering Cost,Gathering Bonus
dragonfire_dive,Dragonfire Dive,true_ability,"Fire, Jump",40ft,"You jump to the target, not provoking any attacks of opportunity, and attacking the target plus all other creatures within 5ft of the target for Heavy Fire Damage.",Polearm only.,AP: 2 MP: 2,2,2,,,,,,,,
draw_elements,Draw Elements,true_ability,,,"You may choose an element. Until the start of your next turn, you are considered to have mastered that element.",,AP: 0 MP: 1,1,0,,,,,,,,
draw_elements_ii,Draw Elements II,true_ability,Quick,Self,"You may choose an element. Until the start of your next turn, you are considered to have mastered that element.",,AP: 0,,0,,,,,,,,
draw_in,Draw-In,true_ability,Combo,Melee Weapon Range,"You make a Light attack against the target. On damage, they are pulled up to 5ft towards you.

Combo: If used after Lunge, the range of this attack and the pullback distance are doubled. This consumes the Lunge effect.",Polearm only.,AP: 1,,1,,,,,,,,
drink_to_battle,Drink to Battle,true_ability,Encounter Start,Self,"You drink some Alcohol in preparation for a battle, granting you 1 stack of Tipsy.",,Other: 2 AP or Encounter Start action,,,,other: 2 AP or Encounter Start action,,,,,,
dualcast,Dualcast,true_ability,Arcane,Self,You immediately repeat the last used ability with the same target. Any cost must be paid as normal.,Must be used immediately after successfully using an ability with the spell keyword.,AP: 0 MP: 1,1,0,,,,,,,,
duelist_blow,Duelist Blow,true_ability,,Melee Weapon Range,You make a Heavy Attack against the target. Your next Block or Dodge reaction against that target costs 0 RP. This benefit disappears when you use an RP ability against a target other than the target of this ability.,,AP: 2 MP: 1,1,2,,,,,,,,
dullahans_mount,Dullahan's Mount,true_ability,,Self,"You conjure up a black horse that becomes part of you. You immediately mount when using this ability and upon dismounting, the horse vanishes. While mounted, your movement speed is increased by 30ft and you are considered a large creature, but you may only move in a straight line. When attempting to move through 5ft wide spaces, it is considered difficult terrain for you. You also suffer a -10 penalty to most acrobatics, climbing and swimming checks while mounted.

Any attack against the horse is considered an attack against you instead. As the horse is considered part of you, any displacement or teleport abilities move the horse alongside with you. You may dismount by spending 0 AP.",,AP: 1,,1,,,,,,,,
duplicate,Duplicate,true_ability,"Spell, Arcane",Sight,"You attempt to analyze the spell and duplicate it. After the triggering spell resolves, immediately cast a copy of it. You must select a valid target for this copy, pay any additional mana cost originally on the spell as well as pay any costs that are not AP or RP. Failure to do so will make the duplicated spell fizzle, dissipating the magic harmlessly into the air.

Upon successfully copying the spell, it resolves with the same damage and effects as the original spell, though using your stats to resolve them.

The cost is 1 RP for a 0-2 AP spell or 2 RP for a 3-4 AP spell. Spells with a higher cost cannot be duplicated.

Secret Arts and Esoteric Arts also cannot be duplicated and upon attempting to do so, this ability is canceled and any cost refunded. Unique spells by heroic or boss enemies may also be impossible to duplicate (GM's discretion).",An enemy in range casts a Spell,MP: 1 RP: 1,1,,1,,,,,,,
eagle_hunt,Eagle Hunt,true_ability,"Combo, Jump",,"You leap up to 30ft into the air and then horizontally up to twice your Speed, this movement does not provoke attacks of opportunity. You may use Silentium at any point during the movement, gaining the Combo bonus.",,AP: 2,,2,,,,,,,,
earthen_guardian,Earthen Guardian,true_ability,"Sidestep, Jump",40ft,You jump and sidestep towards the attacked ally and the triggering attack resolves against you instead. You automatically take the Block action against this attack.,"In Steadfast Earth Stance, ally within range is the target of an attack.",MP: 2 RP: 1,2,,1,,,,,,,
efficient_strike,Efficient Strike,gathering_ability,,,"Make a gathering check.  If this maxes node points, all overflow is converted into lucky points.",Must in a gathering session.,Other: 1 Strike Dice,,,,other: 1 Strike Dice,,,,,,
elbow_uppercut,Elbow Uppercut,true_ability,"Bajiquan, Combo, Unarmed Strike",Melee Weapon Range,"You attack the target for Heavy Damage.Combo:If used after an ability with the Unarmed Strike keyword, this ability gains Full Pierce.",,AP: 2 MP: 1,1,2,,,,,,,,
elemental_mastery_dark,Elemental Mastery: Dark,true_ability,,,You gain Elemental Mastery: Dark,,,,,,,,,,,,
elemental_mastery_fire,Elemental Mastery: Fire,true_ability,,,You gain Elemental Mastery: Fire,,,,,,,,,,,,
elemental_mastery_frost,Elemental Mastery: Frost,true_ability,,,You gain Elemental Mastery: Frost,,,,,,,,,,,,
elemental_mastery_lightning,Elemental Mastery: Lightning,true_ability,,,You gain Elemental Mastery: Lightning.,,,,,,,,,,,,
elemental_strike,Elemental Strike,true_ability,,Melee Weapon Range,"You make a Light Attack against the target. On damage, your attack applies an additional effect based on one of your attack's damage type. (If you are able to have multiple damage types on the attack such as through Holy weapon, you may pick any of the effects).

Arcane: The target loses 1 mana.Fire: The target becomes Burning X, where X equals your Power x 3.Water: The target becomes Soaked X, where X equals your power/2 (rounded down) for 1 turn or until they take Lightning damage.Lightning: The target is afflicted with Static X, where X equals your Power x 3Earth/Frost: The target becomes Slowed until the start of your next turn.Wind: You may push the target back 10ft.Holy: You gain temporary hit points equal to your Power + 5.Dark: The target becomes Blinded until after their next attack.",,AP: 1 MP: 1,1,1,,,,,,,,
elemental_sweep,Elemental Sweep,true_ability,,Melee Weapon Range,"You may make a Light Attack against all enemies within range. On damage, your attack applies an additional effect based on one of your attack's damage type. (If you are able to have multiple damage types on the attack such as through Holy weapon, you may pick any of the effects).

Arcane: The target loses 1 mana.Fire: The target becomes Burning X, where X equals your Power x 3.Water: The target becomes Soaked X, where X equals your power/2 (rounded down) for 1 turn or until they take Lightning damage.Lightning: The target is afflicted with Static X, where X equals your Power x 3.Earth/Frost: The target becomes Slowed until the start of your next turn.Wind: You may push the target back 10ft.Holy: You gain temporary hit points equal to your Power+5.Dark: The target becomes Blinded until after their next attack.",,AP: 2 MP: 1,1,2,,,,,,,,
emergency_maneuvers,Emergency Maneuvers,true_ability,,Self,"When you fail a check when operating an airship, you may use this to reroll the check. You must accept the new result and cannot reroll it again.",,MP: 1 RP: 0,1,,0,,,,,,,
emergency_recall,Emergency Recall,true_ability,,Sight,"You give your summon 100 Damage Reduction against the attack. Afterwards, if it is still alive, it is immediately unsummoned.",Your summon from Summon Animal is the target of an attack.,RP: 1,,,1,,,,,,,
emergency_shield,Emergency Shield,true_ability,"Shield, Spell",40ft,The target gains temporary HP equal to 7 + Power.,,MP: 2 RP: 1,2,,1,,,,,,,
emergency_shields,Emergency Shields,key_ability,,,,,,,,,,You may cast Power Word: Shield and Power Word: Guardian Shield (when obtained) by spending 1 RP instead of 2 AP.,,,,,
empower_mana_shield,Empower Mana Shield,true_ability,,Self,You spend X mana to add X*8 to the value of your mana shield until the start of your next turn.,,AP: 1 MP: X,X,1,,,,,,,,
empty_body,Empty Body,true_ability,,Self,You may reroll the failed saving throw and must accept the new result.,You failed a saving throw.,MP: 2 RP: 0,2,,0,,,,,,,
enduring_warmth,Enduring Warmth,true_ability,,,You can emit comforting heat within 30feet that counters the effects of most cold weather. You can activate or deactivate this heat every 1 second.,,,,,,,,,,,,
energy_drain,Energy Drain,true_ability,"Spell, Dark",60ft,"You deal Light true damage to a willing ally other than yourself. You gainHaste, which gives you 2 AP for the rest of this turn. A target can only be affected by haste once per turn.",,AP: 0 MP: 2,2,0,,,,,,,,
escape_artist,Escape Artist,true_ability,,Self,You immediately escape the grapple by twisting and kicking. May be used by spending either AP or RP.,You are grappled.,AP: 1 RP: 1,,1,1,,,,,,,
eternal_flames,Eternal Flames,key_ability,,,,,,,,,,"When you would apply Burning, you instead apply Hellfire. Hellfire functions like Burning, but it cannot no longer be removed the normal way if not removed before the end of the target’s next turn. Hellfire is automatically removed at the end of the encounter., If you apply Hellfire to a target that is already burning, you deal extra fire damage equal to your Power.",,,,,
eternal_mirane_cage,Eternal Mirane Cage,true_ability,"Frost, Spell",Sight,"Instead of killing the target, they are reduced to negative their Max HP +1. The target is encased in Magical Ice for 10 years, rooted on the location and cannot be moved.  The Ice never melts despite temperature and can only be dispelled by Higher Order Magic (such as a Divine Arms), or by you. The Spell effect ends if you die. You can extend the duration of the Frost by 10 years for every 2 mana spent.",Use when an ally attack would kill a target and target is not an ally.,MP: 1 RP: 0,1,,0,,,,,,,
eternal_vigil,Eternal Vigil,true_ability,,,"While in statue mode and sleeping, you make perception checks as if you were awake.",,,,,,,,,,,,
evasive_maneuver,Evasive Maneuver,true_ability,Sidestep,Self,"You Sidestep 5ft in any direction.

When used on your turn, you may spend 1 mana and 0 AP on this ability instead.",,RP: 1,,,1,,,,,,,
evil_eye,Evil Eye,key_ability,,,,,,,,,,"While you have a Mystic Eye active, you gain a +10 bonus to perception checks relying on sight., One of your eyes becomes an Evil Eye. It may be used to make Mystic Eye type abilities of the appropriate type. An eye can only be a single mystic eye type.",,,,,
evil_eye_of_death,Evil Eye of Death,true_ability,"Mystic Eye, Upkeep",60ft,"You open your Mystic Eye, focus it on a single target and they instantly die.

Upkeep: 3 AP. When you pay the upkeep cost, you may repeat this attack against a new target.",Target must be a grunt.,AP: 4 MP: 2,2,4,,,,,,,,
evil_eye_of_fear,Evil Eye of Fear,true_ability,"Mystic Eye, Upkeep, Fear, Mind Affecting",60ft,"You open your Mystic Eye and inflict fear on everything in sight.

All targets in a 90 degree cone up to range must make a save against your potency or become Shaken until the start of your next turn.

Upkeep: 1 AP. When you pay the upkeep cost, you may repeat this attack.",,AP: 1 MP: 1,1,1,,,,,,,,
evil_eye_of_lethargy,Evil Eye of Lethargy,true_ability,"Mystic Eye, Upkeep, Slow",60ft,"You open your Mystic Eye and inflict lethargy on everything in sight.

All targets in a 90 degree cone up to range become Slowed until the start of your next turn, unless they spent 1 RP to resist the effect.

Upkeep: 1 AP. When you pay the upkeep cost, you may repeat this attack.",,AP: 1 MP: 1,1,1,,,,,,,,
excavation_crash,Excavation Crash,true_ability,,Melee Weapon Range,"Choose one adjacent location 5ft from the target. The target may immediately use a move action for 0 RP to move there if they wish, you cannot make an attack of opportunity during Excavation Crash. If the target does not move to the location, make a heavy attack against them.",,AP: 1 MP: 1,1,1,,,,,,,,
execute_heretic,Execute Heretic,true_ability,"Sure Hit, Full Pierce",Melee Weapon Range,You deal damage to the target equal to their max HP.,Target must be downed.,AP: 1,,1,,,,,,,,
execute_the_heretic,Execute the Heretic,key_ability,,,,,AP: 1,,1,,,You may use Execute Heretic,Execute Heretic (execute_heretic),,,,
expanded_circuits,Expanded Circuits,key_ability,,,,,,,,,,You gain +2 maximum mana.,,,,,
expanded_menagerie,Expanded Menagerie,key_ability,,,,,,,,,,You may spend 1 mana with using Summon Animal to choose which animal you summon.,,,,,
expert_alchemist,Expert Alchemist,key_ability,,,,,,,,,,You gain Alchemeister Core Crafting Abilities.,Alchemeister Core Crafting (alchemeister_core_crafting),,,,
expert_farmer,Expert Farmer,true_ability,,,"Greater Infuse QiKeywords:RapidDescription:You infuse one of the planted herbs with Qi, upgrading it from rare to mystic and adding 20 to its difficulty.

Bountiful Harvest IIKeywords:RapidDescription:You bless one of the planted seeds that grants Food units or Alchemy materials. It grants 4 times that amount and you add 10 to its difficulty. Does not stack.",,,,,,,,,,,,
expert_scribe,Expert Scribe,key_ability,,,,,,,,,,"You gain +5 points in Art: Calligraphy expertise skill., You may draw scrolls, talismans or similar objects for 0 AP once per turn. When you do, reduce the AP cost of that talisman by 1.",,,,,
expertise_study_armorsmithing,Expertise Study (Armorsmithing),true_ability,,,You gain 4 Expertise Points in 3 different armorsmithing crafts. You also gain wielding proficiency in Heavy Armor or Greatshields.,,,,,,,,,,,,
expertise_study_artificing,Expertise Study (Artificing),true_ability,,,You gain 4 expertise points in 3 different Artificing crafts.  You also gain one basic weapon proficiency or one specialized weapon proficiency of your choice.,,,,,,,,,,,,
expertise_study_blacksmithing,Expertise Study (Blacksmithing),true_ability,,,You gain 4 Expertise Points in 3 different blacksmithing crafts. You also gain wielding proficiency in one smithing melee weapon of your choice. You may select specialized weapons with this.,,,,,,,,,,,,
expertise_study_carpentry,Expertise Study (Carpentry),true_ability,,,You gain 4 Expertise Points in 3 different carpentry crafts.  You also gain wielding proficiency in one carpentry weapon of your choice or artifice chainsaws.,,,,,,,,,,,,
explosive_advance,Explosive Advance,true_ability,Encounter Start,Self,You immediately activate Horse Step Acceleration and it becomes active for the entire first round of combat.  Immediately make up to 1 AP of movement actions.,,,,,,,,,,,,
explosive_ward,Explosive Ward,true_ability,"Bounded Field, Fire, Spell",Touch,"A ward that can be placed on a door or medium-sized container of some sort. If someone other than you opens the door or container, the ward triggers creating a loud noise and dealing Heavy Fire Damage to all creatures in a 10ft radius around the container. All items inside the container (if any) also take this damage. Once triggered, the bounded field vanishes. Casting this takes 10 minutes of uninterrupted casting. You may at the time of casting choose a number of people equal to your Focus that can also open the container or door without triggering the ward. If not triggered, Explosive Ward lasts until you remove it. For each Explosive Ward you maintain your maximum mana is reduced by 2. This is considered a tier 2 ward.",,MP: 2,2,,,,,,,,,
extending_spear,Extending Spear,true_ability,,30ft,You may make a Light Attack against all targets in a line up to the range.,Polearm only.,AP: 2,,2,,,,,,,,
extra_arms,Extra Arms,true_ability,Quick,Self,Your next interact with object costs 1 less AP.,,AP: 0,,0,,,,,,,,
fading_counter,Fading Counter,true_ability,"Counter, Illusion",Self,"When the enemy attacks you in melee, they instead attack an illusionary clone, missing you. You may then immediately attack the enemy with a basic Light Melee Attack. You may then move up to 5ft in any direction and this movement does not provoke attacks of opportunity.",,MP: 1 RP: 2,1,,2,,,,,,,
faerie_eyes_calling,Faerie Eyes: Calling,true_ability,"Charm, Illusion",30ft,"You activate your Faerie Eyes, charming a target to move their Speed towards you. If your Focus is higher than the target’s the target moves up to its speed towards you. The target immediately stops their movement if they are going to take damage from further movement. Against Grunts, this attack always hits regardless of Focus, costs 0 mana, and the target will continue to move even if it will take damage.",,AP: 1 MP: 1,1,1,,,,,,,,
faerie_flash,Faerie Flash,true_ability,"Teleport, Rage",,You Teleport up to twice your Speed to an unoccupied space that you can see. Can only be used once per encounter.,,AP: 1 MP: 1,1,1,,,,,,,,
faerie_flash_ii,Faerie Flash II,true_ability,Teleport,,You Teleport up to twice your Speed to an unoccupied space that you can see.,,AP: 1 MP: 1,1,1,,,,,,,,
faerie_light_eyes,Faerie Light Eyes,key_ability,,,,,,,,,,"Faerie Light Eyes provide protection against Illusions, giving you the ability to immediately see the reality warping distortions that illusions cause.  The user is not only notified of illusions, but immune to all but your own., One of your eyes becomes a Faerie Light Eye. It may be used to make Mystic Eye type abilities of the appropriate type. An eye can only be a single mystic eye type.",,,,,
faerie_light_eyes_empty,Faerie Light Eyes:  Empty,true_ability,"Concentration, Mind Affecting, Illusion",60ft,"You lock eyes with an enemy, casting an illusion onto the target’s mind. Name an ability that the target had previously used in the current encounter. The target forgets the target ability, being unable to use it completely while the Illusion is in effect. This ability cannot target Secret Arts, Climax Arts or Esoteric Arts. Only one target may be under the effect of this illusion at a time. If the target is non-heroic and under the effect of Faerie Light Eyes: Hold Person, instead the target immediately is rendered insane permanently. An insane target takes no further combat actions.

Does not work against Boss type enemies.",Enemy has used the target ability,AP: 2,,2,,,,,,,,
faerie_light_eyes_golden_illusion,Faerie Light Eyes: Golden Illusion,true_ability,"Illusion, Mind Affecting",Self,"You copy the target’s ability that was forgotten and add it to your abilities until the end of the encounter. You must still fulfill all requirements to use this skill. This ability is generated from illusions and gains the keyword, Illusion. You can only have one Golden Illusion ability at a time.

If the target stops being affected by Empty, you lose your Golden Illusion ability.",A target is affected by Faerie Light Eyes: Empty.,RP: 0,,,0,,,,,,,
faerie_light_eyes_hold_person,Faerie Light Eyes: Hold Person,true_ability,"Illusion, Mind Affecting, Stun",60ft,"You gaze into the target’s eyes and stun them for 1 turn, reducing their AP and RP to 0. While stunned, the target can also not take any actions.",Target must be non-heroic and have eyes.,MP: 1 RP: 1,1,,1,,,,,,,
faerie_light_eyes_time_dilation,Faerie Light Eyes: Time Dilation,true_ability,,Self,"Flooding your eyes with magic, you cast a self Illusion causes time slow down. You use the Dodge action with a Dodge bonus equal to 2X.",You are the target of a single-target attack.,MP: X RP: 1,X,,1,,,,,,,
faithful_shield,Faithful Shield,true_ability,Overcharge,Self,"You may use Shelter once at 0 RP cost if the target is your Soulmate. This effect lasts until the start of your next turn.

Overcharge:You may spend 4 AP on this ability to instead gain 2 free uses of Shelter.

These free uses ignore the normal limitation of using an ability only once per turn.",,AP: 2,,2,,,,,,,,
fallen_friend,Fallen Friend,key_ability,,,,,,,,,,"When an Heroic tier ally reaches 0 HP, you may immediately enter Rage Stance for 0 AP and RP as well as 0 mana. You can use this even if you don’t have the Rage ability yet.",,,,,
fan_of_knives,Fan of Knives,true_ability,,20ft,You may make a Light Attack against all enemies in range. This is considered a Ranged Weapon Attack that does not provoke attacks of opportunity.,"Throwing Weapon, Set of Missiles or Thrown attack only.",AP: 2,,2,,,,,,,,
fancy_footwork,Fancy Footwork,key_ability,,,,,,,,,,"You gain proficiency with Dueling Weapons. While wielding a dueling weapon, you also gain the light blades' Nimble ability, even if not wielding or proficient with light blades.",,,,,
farming_basics,Farming Basics,key_ability,,,,,,,,,,"You gain proficiency in the scythe specialized weapon and can use it as farming tool. You also gain proficiency in the Sickle and can use it as a farming tool and One-Handed axe., You can plant seeds in plots of land that sprout into harvestable Food and Alchemy materials. You can work 10 plots of land., You gain Farmer core abilities.",,,,,
farming_basics_harvest,Harvest,crafting_ability,,,"You harvest the planted seeds or take care of the plants not ready to be harvested yet. Do a crafting session. Your crafting score is the total value of seeds you can harvest or take care of. If your crafting score is not high enough to harvest or take care of all seeds you planted, you must give up on some of the seeds. Starting from the seed with the highest difficulty, you drop seeds until your total crafting score matches or exceeds the total difficulty of the seeds.Infuse QiKeywords:RapidDescription:You infuse one of the planted herbs with Qi, upgrading it from common to rare and adding 10 to its difficulty. Bountiful HarvestKeywords:RapidDescription:You bless one of the planted seeds that grants Food units or Alchemy materials. It grants double that amount and you add 5 to its difficulty. Does not stack.",,,,,,,,,farming_basics,3,,
farming_basics_sow_seeds,Sow Seeds,crafting_ability,,,You may plant seeds in plots of land. You may plant 1 set of seeds in each plot of land you can work.,,,,,,,,,farming_basics,2,,
farming_basics_spiritual_ground,Spiritual Ground,crafting_ability,,,"You infuse the land with your spiritual energy, creating up to 10 plots of land suitable for farming. These plots of lands can grow food and herbs at an accelerated rate and allow the planting of tier 1 rare herbs. All plots of land must be filled with seeds before they begin growing. After creating a spiritual ground, you may immediately use Sow Seeds in it for 0 IP. You can only have 1 spiritual ground at the same time.",,,,,,,,,farming_basics,1,,
fast_dimensional_equip,Fast Dimensional Equip,true_ability,,Self,"You summon an item from your dimensional armory into your hand. You can also send a held weapon (not wielded or carried by another creature) under your full control to your Dimensional Armory and swap it with another from your Dimensional Armory.

You may use 1 RP to activate this ability. If you do, the Mana cost is reduced by 1.",You have a Dimension Armory active.,MP: 1 RP: 0,1,,0,,,,,,,
fast_hands,Fast Hands,true_ability,Quick,,You reduce the AP cost of your next Interact with object action this turn by 1.,,AP: 0,,0,,,,,,,,
fast_runner,Fast Runner,true_ability,,,Your base movement speed is 25ft instead of 20ft.,,,,,,,,,,,,
feeding_frenzy,Feeding Frenzy,true_ability,,Self,"You may use this after reducing an enemy’s hit points to 0 or less.

You may immediately use your Vampire Bite ability for 0 RP against the enemy you downed.",Must be under the effects of Blood Frenzy.,RP: 0,,,0,,,,,,,
feigned_retreat,Feigned Retreat,true_ability,Sidestep,40ft,"All allies in a 15x15ft square within range may Sidestep up to their speed towards you.

If they successfully left an enemy’s melee range and are not in an enemy’s melee range after moving, then the first time an enemy enters their melee range before the start of their next turn, they may make an Attack of Opportunity against that enemy.",,AP: 2 MP: 1,1,2,,,,,,,,
feint,Feint,true_ability,,15ft,"You target an enemy. If the target is a Grunt or you have higher Agility than the target, then they cannot make an attack of opportunity against you until the start of your next turn.",,AP: 1,,1,,,,,,,,
felling_strike,Felling Strike,true_ability,,Melee Weapon Range,"Make a heavy attack against a target enemy that is no larger than large size category. On damage, sidestep to any unoccupied space next to the target, of the same elevation as the target, and knockback the target 10ft.","Axe, Chainsaw and Giant Scissors Only",AP: 2 MP: 2,2,2,,,,,,,,
fiery_rebirth,Fiery Rebirth,true_ability,Downed,Self,"You regain HP until you are at 1 HP, stand up from prone and deal Light full pierce fire damage to all enemies within 5ft of you.

After using this ability, the mortal wound condition is removed from you and you cannot use Fiery Rebirth again for the rest of the arc.",You’ve suffered a mortal wound.,MP: 5 RP: 0,5,,0,,,,,,,
fight_or_flight,Fight or Flight,true_ability,Rage,Self,"Fight:You immediately gain 2 AP that can be used on basic abilities, but lose 1 RP.

Flight:You immediately gain 1 RP, but recover 2 less AP on your next turn.

You regain the use of this ability after the Encounter Conclusion phase.",,RP: 0,,,0,,,,,,,
fighters_journey,Fighter's Journey,key_ability,,,,,,,,,,"You gain proficiency in 5 common weapons groups., You gain proficiency in all light armor, medium armor and normal shields., You gain +5 HP.",,,,,
fire_stance,Fire Stance,key_ability,,,,,MP: 1 RP: 0,1,,0,,You may use Tempestuous Fire Stance,Tempestuous Fire Stance (tempestuous_fire_stance),,,,
fireball,Fireball,true_ability,"Fire, Spell",60ft,"You hurl a Fireball at a 15x15ft area, making a Light Attack that deals Fire Damage against all units in the area.",,AP: 2,,2,,,,,,,,
